serial_no,reviewer_name,room_type,period_of_stay,traveler_type,review_score_numerator,review_score_denominator,review_score_description,review_date,review_text,extraction_timestamp,review_detected_lang,review_translated
687,A‍w‍e‍i,Sands Premier Double Queen Gardens By The Bay View,Stayed in December 2023,Family,8.0,/10,Very Good,"Posted December 17, 2023","There is nothing to say about the room, environment, or facilities. It deserves to be a first-class hotel. However, the hotel garden view room booked on Ctrip was stated to be from the 10th to 40th floors, and the room assigned to me was on the 8th floor. Although it was a bit low, after reporting it, I said that Ctrip promised it. It has nothing to do with the hotel. If you want to upgrade, you need to pay extra. Since you booked it with Ctrip, the room rate is also fully paid, so the room should be reserved. If you can't do it with Ctrip, don't write it in vain!",2025-09-08 22:51:15,en,"There is nothing to say about the room, environment, or facilities. It deserves to be a first-class hotel. However, the hotel garden view room booked on Ctrip was stated to be from the 10th to 40th floors, and the room assigned to me was on the 8th floor. Although it was a bit low, after reporting it, I said that Ctrip promised it. It has nothing to do with the hotel. If you want to upgrade, you need to pay extra. Since you booked it with Ctrip, the room rate is also fully paid, so the room should be reserved. If you can't do it with Ctrip, don't write it in vain!"
688,S‍h‍a‍n‍g‍h‍a‍i‍d‍o‍u‍f‍e‍n‍g,,Stayed in June 2023,Family,10.0,/10,Outstanding,"Posted June 17, 2023","The most satisfying accommodation experience. Due to the large queues at check-in, we were transferred to the VIP reception room for us. A Korean lady at the front desk gave us as much enthusiasm as possible in not-so-fluent Chinese. We upgraded the hotel's newly renovated superior double room. The room is exquisite and high-end. My wife and children are very happy!",2025-09-08 22:51:16,en,"The most satisfying accommodation experience. Due to the large queues at check-in, we were transferred to the VIP reception room for us. A Korean lady at the front desk gave us as much enthusiasm as possible in not-so-fluent Chinese. We upgraded the hotel's newly renovated superior double room. The room is exquisite and high-end. My wife and children are very happy!"
689,Q‍i‍n‍g‍f‍e‍n‍g‍s‍h‍e‍n‍g‍m‍i‍n‍g,,Stayed in June 2023,Couple,10.0,/10,Outstanding,"Posted June 15, 2023","It's very good. The newly renovated room in Building 2 was upgraded for free. It has an automatic toilet, a large bathtub, a super large city cbd, and a panoramic view. I'm really satisfied with the stay, and the hotel service is very good.",2025-09-08 22:51:18,en,"It's very good. The newly renovated room in Building 2 was upgraded for free. It has an automatic toilet, a large bathtub, a super large city cbd, and a panoramic view. I'm really satisfied with the stay, and the hotel service is very good."
690,G‍u‍e‍s‍t‍ ‍U‍s‍e‍r,,Stayed in April 2024,Couple,10.0,/10,Outstanding,"Posted May 24, 2024","First-class room facilities, hygiene, environment and services",2025-09-08 22:51:19,en,"First-class room facilities, hygiene, environment and services"
691,A‍n‍o‍n‍y‍m‍o‍u‍s‍ ‍U‍s‍e‍r,,Stayed in December 2023,Business traveller,9.0,/10,Great,"Posted December 11, 2023","The bathroom is big enough, but there is no bathtub. There is no door in the shower room. Water floats everywhere. Alas, there is a problem with the design. Is such a luxurious hotel cheap?",2025-09-08 22:51:26,en,"The bathroom is big enough, but there is no bathtub. There is no door in the shower room. Water floats everywhere. Alas, there is a problem with the design. Is such a luxurious hotel cheap?"
692,A‍n‍o‍n‍y‍m‍o‍u‍s‍ ‍U‍s‍e‍r,,Stayed in June 2023,Family,10.0,/10,Outstanding,"Posted June 12, 2023","Great experience. Looking forward to staying again next time. The hotel is not only the scenery, but also a more convenient and humanized concept and experience.",2025-09-08 22:51:28,en,"Great experience. Looking forward to staying again next time. The hotel is not only the scenery, but also a more convenient and humanized concept and experience."
693,Z‍h‍i‍l‍i‍a‍n‍g‍z‍h‍i‍（‍d‍a‍n‍d‍a‍n‍d‍i‍r‍o‍n‍g‍）,,Stayed in June 2023,Solo traveller,10.0,/10,Outstanding,"Posted June 10, 2023","The room environment is beautiful and privacy protection is in place, but without a water purifier and smart toilet, a hotel of this level cannot be justified. But the dishes and prepared drinks are great, one or two older male waiters have a mediocre attitude. But the scenery is indeed invincible!",2025-09-08 22:51:29,en,"The room environment is beautiful and privacy protection is in place, but without a water purifier and smart toilet, a hotel of this level cannot be justified. But the dishes and prepared drinks are great, one or two older male waiters have a mediocre attitude. But the scenery is indeed invincible!"
694,奧‍斯‍汀‍台‍客‍趴‍趴‍造,,Stayed in May 2023,Family,10.0,/10,Outstanding,"Posted June 1, 2023","I really, really like the Sands Hotel. I fell in love with Singapore even more because of it. The service is super good 👍Because of our wedding anniversary, we were upgraded to a high-end balcony room with fully automatic remote control. At night, we can watch the endless light show of the Sky Tree from the balcony We went to the swimming pool three times in the morning, noon and evening. The super beautiful scenery is unforgettable. When we went out, we even sent us a cake to celebrate our anniversary. All the services are heartwarming. It really deserves to stay in a hotel for this life. I like it so much 😘",2025-09-08 22:51:30,en,"I really, really like the Sands Hotel. I fell in love with Singapore even more because of it. The service is super good 👍Because of our wedding anniversary, we were upgraded to a high-end balcony room with fully automatic remote control. At night, we can watch the endless light show of the Sky Tree from the balcony We went to the swimming pool three times in the morning, noon and evening. The super beautiful scenery is unforgettable. When we went out, we even sent us a cake to celebrate our anniversary. All the services are heartwarming. It really deserves to stay in a hotel for this life. I like it so much 😘"
695,A‍n‍o‍n‍y‍m‍o‍u‍s‍ ‍U‍s‍e‍r,,Stayed in November 2023,Family,10.0,/10,Outstanding,"Posted December 2, 2023","The hotel is divided into three buildings. The room I went to at the beginning was a bit old. After the upgrade, the room was very good, with first-class facilities. The infinity pool of the hotel is great. I will choose to stay there next time.",2025-09-08 22:51:31,en,"The hotel is divided into three buildings. The room I went to at the beginning was a bit old. After the upgrade, the room was very good, with first-class facilities. The infinity pool of the hotel is great. I will choose to stay there next time."
696,S‍V‍E‍T‍L‍A‍N‍A,,Stayed in November 2023,Booked for others,10.0,/10,Outstanding,"Posted December 1, 2023","Of course, many people choose this hotel to stay there for at least 1 night for the opportunity to get into the Infinity pool on the roof))
That's exactly what we did.
The hotel is above all praise! All at the highest level! Only pleasant positive impressions by all criteria.",2025-09-08 22:51:33,en,"Of course, many people choose this hotel to stay there for at least 1 night for the opportunity to get into the Infinity pool on the roof))
That's exactly what we did.
The hotel is above all praise! All at the highest level! Only pleasant positive impressions by all criteria."
697,G‍u‍e‍s‍t‍ ‍U‍s‍e‍r,,Stayed in November 2023,Family,10.0,/10,Outstanding,"Posted November 27, 2023","The room facilities are very good, and the beautiful woman at the front desk upgraded her. High praise! Will choose to stay next time",2025-09-08 22:51:34,en,"The room facilities are very good, and the beautiful woman at the front desk upgraded her. High praise! Will choose to stay next time"
698,싱‍가‍포‍르‍라‍이‍프,,Stayed in November 2023,Family,10.0,/10,Outstanding,"Posted November 27, 2023","I had a great time with my family. I live in Singapore and come here often, and the kids are satisfied every time I come.
It's expensive, but it's very expensive^^",2025-09-08 22:51:35,en,"I had a great time with my family. I live in Singapore and come here often, and the kids are satisfied every time I come.
It's expensive, but it's very expensive^^"
699,G‍u‍e‍s‍t‍ ‍U‍s‍e‍r,,Stayed in May 2023,Business traveller,10.0,/10,Outstanding,"Posted May 29, 2023","A very good trip. During the exhibition, the price was a bit expensive and the service was average. I hope there can be more proactive and sincere service. It is very good at night.",2025-09-08 22:51:35,en,"A very good trip. During the exhibition, the price was a bit expensive and the service was average. I hope there can be more proactive and sincere service. It is very good at night."
700,G‍u‍e‍s‍t‍ ‍U‍s‍e‍r,,Stayed in June 2024,Family,10.0,/10,Outstanding,"Posted July 10, 2024","Except for the price, everything else is great👍🏻",2025-09-08 22:51:36,en,"Except for the price, everything else is great👍🏻"
701,G‍u‍e‍s‍t‍ ‍U‍s‍e‍r,,Stayed in April 2024,Couple,10.0,/10,Outstanding,"Posted April 6, 2024",The details in every aspect are well done and well deserved.,2025-09-08 22:51:44,en,The details in every aspect are well done and well deserved.
702,G‍u‍e‍s‍t‍ ‍U‍s‍e‍r,Sands Premier King Gardens By The Bay View,Stayed in November 2023,Business traveller,7.5,/10,,"Posted November 23, 2023","When making the reservation, Ctrip clearly stated that it was a garden view room on floors 10-40. However, when I checked in at 4 pm, it was said that there was no such room type. After a long delay of about 30 minutes, they finally arranged it for me at room 8. Floor, this floor is not at the same price as what I booked. The experience is too bad. Please contact Ctrip to confirm with the hotel, refund me the price difference, and compensate for my losses.",2025-09-08 22:51:45,en,"When making the reservation, Ctrip clearly stated that it was a garden view room on floors 10-40. However, when I checked in at 4 pm, it was said that there was no such room type. After a long delay of about 30 minutes, they finally arranged it for me at room 8. Floor, this floor is not at the same price as what I booked. The experience is too bad. Please contact Ctrip to confirm with the hotel, refund me the price difference, and compensate for my losses."
703,m‍i‍r‍a‍n‍d‍a‍ ‍c‍h‍e‍n,,Stayed in November 2023,Travelling with friends,9.0,/10,Great,"Posted November 21, 2023","The hotel is very beautiful. There are many shops nearby for shopping and eating, which is very convenient. The view from the infinity pool is very beautiful. However, the service staff at the rooftop restaurant had a poor attitude and asked us to go to other restaurants with an impatient tone.",2025-09-08 22:51:47,en,"The hotel is very beautiful. There are many shops nearby for shopping and eating, which is very convenient. The view from the infinity pool is very beautiful. However, the service staff at the rooftop restaurant had a poor attitude and asked us to go to other restaurants with an impatient tone."
704,G‍u‍e‍s‍t‍ ‍U‍s‍e‍r,,Stayed in November 2023,Business traveller,10.0,/10,Outstanding,"Posted November 27, 2023","The customer is satisfied, the customer is satisfied, the customer is satisfied, the customer is satisfied, the customer is satisfied, the customer is satisfied, the customer is satisfied, the customer is satisfied, the customer is satisfied",2025-09-08 22:51:48,en,"The customer is satisfied, the customer is satisfied, the customer is satisfied, the customer is satisfied, the customer is satisfied, the customer is satisfied, the customer is satisfied, the customer is satisfied, the customer is satisfied"
705,G‍u‍e‍s‍t‍ ‍U‍s‍e‍r,Sands Premier King City View,Stayed in June 2024,Business traveller,10.0,/10,Outstanding,"Posted June 12, 2024","very good 

Hygienic and clean:
good service
:",2025-09-08 22:51:49,en,"very good 

Hygienic and clean:
good service
:"
706,y‍o‍o‍n‍g‍m‍a,,Stayed in May 2023,Family,10.0,/10,Outstanding,"Posted May 21, 2023","What would you say about Marina Bay Sands in Singapore?
All of the staff were kind and friendly.
After storing my luggage in advance before check-in time, the room was ready, so I called and was able to check in around 13:00.
The swimming pool was nice and the garden view was beautiful, so I made good memories.",2025-09-08 22:51:50,en,"What would you say about Marina Bay Sands in Singapore?
All of the staff were kind and friendly.
After storing my luggage in advance before check-in time, the room was ready, so I called and was able to check in around 13:00.
The swimming pool was nice and the garden view was beautiful, so I made good memories."
707,G‍u‍e‍s‍t‍ ‍U‍s‍e‍r,,Stayed in May 2023,Couple,10.0,/10,Outstanding,"Posted July 24, 2023","The Orchid Suite is really nice, and it also comes with afternoon tea and airport drop-off. The room balcony has a beautiful sea view.",2025-09-08 22:51:52,en,"The Orchid Suite is really nice, and it also comes with afternoon tea and airport drop-off. The room balcony has a beautiful sea view."
708,H‍a‍p‍p‍y‍ ‍t‍r‍a‍v‍e‍l‍e‍r‍r‍r‍r,,Stayed in June 2024,Family,9.5,/10,Amazing,"Posted June 8, 2024",乾淨 整潔 泳池很美,2025-09-08 22:51:53,zh-TW,"Clean and tidy, beautiful swimming pool"
709,G‍u‍e‍s‍t‍ ‍U‍s‍e‍r,,Stayed in November 2023,Couple,10.0,/10,Outstanding,"Posted November 15, 2023","It's very large and there are a lot of employees, and everyone is very friendly.
The room and pool view were really great~",2025-09-08 22:51:54,en,"It's very large and there are a lot of employees, and everyone is very friendly.
The room and pool view were really great~"
710,s‍h‍e‍n‍p‍e‍n‍g‍1,Sands Premier King City View,Stayed in June 2024,Family,10.0,/10,Outstanding,"Posted July 8, 2024",Facilities and services are particularly good,2025-09-08 22:51:54,en,Facilities and services are particularly good
711,G‍u‍e‍s‍t‍ ‍U‍s‍e‍r,,Stayed in November 2023,Family,10.0,/10,Outstanding,"Posted November 17, 2023","It was the best hotel. With the Nespresso coffee in the room, my nausea from traveling to Southeast Asia completely disappeared and I want to go again next time.",2025-09-08 22:52:03,en,"It was the best hotel. With the Nespresso coffee in the room, my nausea from traveling to Southeast Asia completely disappeared and I want to go again next time."
712,G‍u‍e‍s‍t‍ ‍U‍s‍e‍r,,Stayed in November 2023,Family,10.0,/10,Outstanding,"Posted January 14, 2024","It’s very beautiful to take photos and check in. The key room is also very spacious and full of Southeast Asian style. The breakfast is also very rich, with many kinds of fruits. The hygiene is also very good. It is also very convenient to the seaside. The children are very happy.",2025-09-08 22:52:03,en,"It’s very beautiful to take photos and check in. The key room is also very spacious and full of Southeast Asian style. The breakfast is also very rich, with many kinds of fruits. The hygiene is also very good. It is also very convenient to the seaside. The children are very happy."
713,G‍u‍e‍s‍t‍ ‍U‍s‍e‍r,Sands Premier King,Stayed in May 2023,Family,9.5,/10,Amazing,"Posted May 12, 2023","I booked a room that was renewed, and it was so nice. It's a swimming pool. Needless to say, it was nice. I went with my children, but it was so wide that I had to walk a lot, but it's the best hotel",2025-09-08 22:52:05,en,"I booked a room that was renewed, and it was so nice. It's a swimming pool. Needless to say, it was nice. I went with my children, but it was so wide that I had to walk a lot, but it's the best hotel"
714,G‍u‍e‍s‍t‍ ‍U‍s‍e‍r,,Stayed in November 2023,Travelling with friends,10.0,/10,Outstanding,"Posted November 8, 2023","very satisfied! The scenery is endless! There are just too many people in the infinity pool, which is like dumplings.",2025-09-08 22:52:05,en,"very satisfied! The scenery is endless! There are just too many people in the infinity pool, which is like dumplings."
715,B‍a‍i‍p‍a‍n‍g‍x‍i‍a‍o‍j‍i‍e,,Stayed in May 2023,Family,10.0,/10,Outstanding,"Posted May 10, 2023","The room was great with a great view! The service is very good, the flight was early on the last day, and the hotel prepared a packaged breakfast for us, which was exquisite! It just so happened that there was a bicycle race that morning, and the scheduled car to the airport couldn’t come. The Indian guy at the door was very enthusiastic and helped me call a taxi for a long time, and quickly helped me contact the hotel to take us to the airport! Thank you very much!",2025-09-08 22:52:06,en,"The room was great with a great view! The service is very good, the flight was early on the last day, and the hotel prepared a packaged breakfast for us, which was exquisite! It just so happened that there was a bicycle race that morning, and the scheduled car to the airport couldn’t come. The Indian guy at the door was very enthusiastic and helped me call a taxi for a long time, and quickly helped me contact the hotel to take us to the airport! Thank you very much!"
716,t‍o‍m‍o‍r‍r‍o‍w‍1‍9‍7‍3,,Stayed in April 2023,Travelling with friends,10.0,/10,Outstanding,"Posted May 3, 2023","The room is a bit outdated, but the advantage is that the location is super good, the view is invincible, and shopping, food and entertainment are all available downstairs.",2025-09-08 22:52:07,en,"The room is a bit outdated, but the advantage is that the location is super good, the view is invincible, and shopping, food and entertainment are all available downstairs."
717,Z‍u‍i‍h‍o‍u‍d‍e‍r‍e‍n‍0‍0,,Stayed in April 2023,Family,2.0,/10,,"Posted April 29, 2023",5000元一晚的新加坡金沙酒店，還不含早餐，非常不值，房間裝修非常簡單，房間面積還較小，洗手間更小，洗手枱小的可憐，沖涼房和馬桶間沒有門，洗澡水流到外面，水漫金山，作為父親上個廁所都不方便，生怕被孩子看到。沖涼房的花灑是固定的，給孩子洗澡也不方便，如何做一家親子酒店呢？以後都不會再來住金沙，沒有性價比。建議親子家庭千萬不要選這家酒店。,2025-09-08 22:52:08,zh-TW,"At 5,000 yuan a night, and not including breakfast, the Marina Bay Sands Singapore is a complete waste of money. The rooms are simply decorated and small, and the bathrooms are even smaller, with a tiny sink. There&#39;s no door between the shower and toilet, so the shower water leaks out, flooding the entire hotel. Even as a father, I struggled to use the restroom, fearing my child might see me. The showerhead is fixed, making it difficult to bathe my child. How can this be considered a family-friendly hotel? I won&#39;t be staying at the Marina Bay Sands again. It&#39;s simply not worth the money. Families with children should definitely avoid this hotel."
718,G‍u‍e‍s‍t‍ ‍U‍s‍e‍r,,Stayed in April 2023,Family,10.0,/10,Outstanding,"Posted May 2, 2023","Satisfied that the children go swimming every day, eating, lodging and shopping are very convenient, but the price is much more expensive than the original price. Before the epidemic, this price can live up to a very high floor, but now the same price can only live up to the 4th floor. There are still many people checking in, so far There are quite a lot of foreigners coming here. There is also a cake for the child's birthday!",2025-09-08 22:52:10,en,"Satisfied that the children go swimming every day, eating, lodging and shopping are very convenient, but the price is much more expensive than the original price. Before the epidemic, this price can live up to a very high floor, but now the same price can only live up to the 4th floor. There are still many people checking in, so far There are quite a lot of foreigners coming here. There is also a cake for the child's birthday!"
719,G‍u‍e‍s‍t‍ ‍U‍s‍e‍r,,Stayed in April 2023,Family,8.0,/10,Very Good,"Posted April 26, 2023","On April 23, I stayed at the long-awaited Marina Bay Sands, Singapore, which is known as the world's top hotel. The room given to us at the beginning (tower 3-1628, see pictures 1, 2, and 3) made me extremely disappointed and angry. This room is a deluxe double room booked on Ctrip. It costs more than 5,000 yuan per night. According to visual inspection, it is only a dozen square meters. The facilities are old and aging, and they are not even equipped with the basic facilities of five-star hotels such as weighbridges and bathtubs. I don't think even the 3-star hotels in China can reach it, so dare to charge for 7-star hotels. After complaining to Ctrip that I couldn’t change the room, I had to communicate directly with the hotel management. After 5 minutes, I decided to change room 1086 in Tower 2, which was newly renovated 4 months ago (Figure 4-9). With fully automatic remote control facilities in the room, and 100$ as dinner fee, this room can be given 5 stars. Therefore, should Ctrip Overseas Department be mainly responsible for this very unpleasant experience? Ctrip must make an explanation and other follow-up matters, otherwise it will be suspected of defrauding consumers. When our own people do not fight for the interests or rights of our own people, we must not compromise easily. Finally, I would like to thank the hotel manager Cai, Sherman Chua, who solved the problem efficiently and properly for me).",2025-09-08 22:52:11,en,"On April 23, I stayed at the long-awaited Marina Bay Sands, Singapore, which is known as the world's top hotel. The room given to us at the beginning (tower 3-1628, see pictures 1, 2, and 3) made me extremely disappointed and angry. This room is a deluxe double room booked on Ctrip. It costs more than 5,000 yuan per night. According to visual inspection, it is only a dozen square meters. The facilities are old and aging, and they are not even equipped with the basic facilities of five-star hotels such as weighbridges and bathtubs. I don't think even the 3-star hotels in China can reach it, so dare to charge for 7-star hotels. After complaining to Ctrip that I couldn’t change the room, I had to communicate directly with the hotel management. After 5 minutes, I decided to change room 1086 in Tower 2, which was newly renovated 4 months ago (Figure 4-9). With fully automatic remote control facilities in the room, and 100$ as dinner fee, this room can be given 5 stars. Therefore, should Ctrip Overseas Department be mainly responsible for this very unpleasant experience? Ctrip must make an explanation and other follow-up matters, otherwise it will be suspected of defrauding consumers. When our own people do not fight for the interests or rights of our own people, we must not compromise easily. Finally, I would like to thank the hotel manager Cai, Sherman Chua, who solved the problem efficiently and properly for me)."
720,G‍u‍e‍s‍t‍ ‍U‍s‍e‍r,,Stayed in March 2024,Family,10.0,/10,Outstanding,"Posted March 31, 2024",,2025-09-08 22:52:12,no_text,
721,k‍i‍m‍b‍e‍r‍l‍e‍y,,Stayed in April 2023,Family,9.5,/10,Amazing,"Posted April 9, 2023","When staying in May 2014, the price was 2300 a night, and in April 2023 the price has increased to 4800 a night. Although there is no room available until five o'clock. The rooms are old. But the advantage is that the swimming pool is beautiful, and the breakfast is still delicious. not bad.",2025-09-08 22:52:20,en,"When staying in May 2014, the price was 2300 a night, and in April 2023 the price has increased to 4800 a night. Although there is no room available until five o'clock. The rooms are old. But the advantage is that the swimming pool is beautiful, and the breakfast is still delicious. not bad."
722,A‍n‍d‍o‍n‍g‍n‍i‍d‍e‍x‍i‍a‍t‍i‍a‍n,,Stayed in April 2023,Business traveller,10.0,/10,Outstanding,"Posted April 17, 2023","Great room, great service, the check-in manager is a beautiful woman with glasses, excellent, the swimming pool is great, the room is comfortable and spacious, I will never leave, I fell in love with Singapore Garden",2025-09-08 22:52:21,en,"Great room, great service, the check-in manager is a beautiful woman with glasses, excellent, the swimming pool is great, the room is comfortable and spacious, I will never leave, I fell in love with Singapore Garden"
723,M‍I‍N‍ ‍S‍O‍K,,Stayed in July 2023,Family,9.5,/10,Amazing,"Posted October 6, 2023","I used a suite, and the view was great.",2025-09-08 22:52:22,en,"I used a suite, and the view was great."
