serial_no,reviewer_name,room_type,period_of_stay,traveler_type,review_score_numerator,review_score_denominator,review_score_description,review_date,review_text,extraction_timestamp,review_detected_lang,review_translated
1,N‍a‍n‍c‍y‍a,Sands Premier Double Queen City View Room,Stayed in September 2025,Family,10.0,/10,Outstanding,"Posted September 2, 2025",,2025-09-08 22:36:08,no_text,
2,С‍т‍е‍п‍а‍н‍о‍в‍а‍Е‍в‍г‍е‍н‍и‍я,Sands Family Suite,Stayed in August 2025,Family,10.0,/10,Outstanding,"Posted September 2, 2025","💝 Unforgettable memories and impressions that will stay with us for the rest of our lives! 💝
🎶 Eunice Marasigan welcomed us and surrounded us with such care. You will be in our memory for a long time! 
Do I need to write that this hotel is a symbol of Singapore? Is it necessary to describe the delight of the view from the observation deck and from the pool? You need to see this with your own eyes, because the photo does not convey even half of the beauty that the eye sees.
💸 It is expensive. 💸
☺️ Marina Bay Sands is my dream come true. I hope I can come back again. 😇",2025-09-08 22:36:08,en,"💝 Unforgettable memories and impressions that will stay with us for the rest of our lives! 💝
🎶 Eunice Marasigan welcomed us and surrounded us with such care. You will be in our memory for a long time! 
Do I need to write that this hotel is a symbol of Singapore? Is it necessary to describe the delight of the view from the observation deck and from the pool? You need to see this with your own eyes, because the photo does not convey even half of the beauty that the eye sees.
💸 It is expensive. 💸
☺️ Marina Bay Sands is my dream come true. I hope I can come back again. 😇"
3,M‍i‍c‍h‍i‍e‍l‍ ‍A‍n‍ ‍K‍r‍y‍s‍t‍y‍n,Sands Premier King,Stayed in September 2025,Couple,10.0,/10,Outstanding,"Posted September 4, 2025",They upgraded us to City View! Had a wonderful time! We will definitely come back!,2025-09-08 22:36:09,en,They upgraded us to City View! Had a wonderful time! We will definitely come back!
4,S‍v‍e‍t‍l‍a‍n‍a,Sands Premier Double Queen Gardens By The Bay View,Stayed in August 2025,Family,10.0,/10,Outstanding,"Posted August 10, 2025","We stayed for three nights (4 days), it took a long time to choose a room. As a result, we rented a room with a view of the gardens, and we didn't regret it. I liked: we lived on the 32nd floor, the room had a balcony, the noise of the city was audible, but not annoying. The view from the balcony was relaxing, it's nice to sit and admire in the evening.  The room was spacious, as was the bathroom. The cosmetics were wonderful!!! Coffee, sweets and tea were delicious! It's unnecessary to write about the pool)), it's the icing on the cake. If you arrive early, you can go to the pool, it is very comfortable there.  We didn't have breakfast, after reading the reviews that it was easier to have a snack somewhere nearby. I can't say that there are a lot of ""eateries"" nearby. Perhaps I would have bought breakfast next time. The transport accessibility is excellent, you can enter the subway from the hotel. 
everything interesting is nearby. If there is an opportunity to stay there, you should do it))",2025-09-08 22:36:10,en,"We stayed for three nights (4 days), it took a long time to choose a room. As a result, we rented a room with a view of the gardens, and we didn't regret it. I liked: we lived on the 32nd floor, the room had a balcony, the noise of the city was audible, but not annoying. The view from the balcony was relaxing, it's nice to sit and admire in the evening.  The room was spacious, as was the bathroom. The cosmetics were wonderful!!! Coffee, sweets and tea were delicious! It's unnecessary to write about the pool)), it's the icing on the cake. If you arrive early, you can go to the pool, it is very comfortable there.  We didn't have breakfast, after reading the reviews that it was easier to have a snack somewhere nearby. I can't say that there are a lot of ""eateries"" nearby. Perhaps I would have bought breakfast next time. The transport accessibility is excellent, you can enter the subway from the hotel. 
everything interesting is nearby. If there is an opportunity to stay there, you should do it))"
5,H‍e‍l‍e‍n‍a,Sands Premier King,Stayed in July 2025,Business traveller,10.0,/10,Outstanding,"Posted July 13, 2025","Satisfying and best hotel,for sure I will come back again for my 3rd times,thank you for a good memories and surprise cake for my sister 🥰❤️",2025-09-08 22:36:12,en,"Satisfying and best hotel,for sure I will come back again for my 3rd times,thank you for a good memories and surprise cake for my sister 🥰❤️"
6,G‍u‍e‍s‍t‍ ‍U‍s‍e‍r,Sands Premier King,Stayed in July 2025,Couple,10.0,/10,Outstanding,"Posted July 9, 2025",This was worth the expensive price tag. We went to the infinity pool many times and the service was so on point! They came to clean our room midday and left clothes for our glasses and pillow spray. Truly a 5 star experience.,2025-09-08 22:36:12,en,This was worth the expensive price tag. We went to the infinity pool many times and the service was so on point! They came to clean our room midday and left clothes for our glasses and pillow spray. Truly a 5 star experience.
7,G‍u‍e‍s‍t‍ ‍U‍s‍e‍r,Sands Premier King Gardens By The Bay View,Stayed in June 2025,Family,10.0,/10,Outstanding,"Posted July 4, 2025","The cleaning lady gives snacks to the children, which is greatly appreciated, and the cleaning is also very thorough. Since we have a four-year-old child staying, we hope that next time a step stool for the child can be provided, as their height is not sufficient.",2025-09-08 22:36:12,en,"The cleaning lady gives snacks to the children, which is greatly appreciated, and the cleaning is also very thorough. Since we have a four-year-old child staying, we hope that next time a step stool for the child can be provided, as their height is not sufficient."
8,H‍a‍h‍a‍h‍a‍r‍m‍o‍n‍y,Sands Premier Suite King Gardens By The Bay View,Stayed in June 2025,Family,10.0,/10,Outstanding,"Posted June 30, 2025","Every member of the Marina Bay Sands team we encountered went above and beyond, turning what could have been just another hotel stay into an unforgettable experience filled with care, comfort, and heart.

A minor accident during our stay—when our daughter tripped over the carpet and had a nosebleed—was handled with exemplary care. The staff member from Express Service prioritized her safety and promptly coordinated housekeeping to assist us. The housekeeping lady who came to help was so humble and kind, even declining a tip for her hard work.

Special recognition also goes to Service Management Team, Ms. Ella Barrientos, who followed up with a compassionate call, offered a thoughtful gift to cheer up our daughter, and even took care of cleaning her top. The warmth and humanity she showed meant so much to us, and we would also like to thank the laundry team for their assistance in removing the blood stain so efficiently.

Our children’s first visit to Singapore has become a treasured memory thanks to the hotel’s exceptional hospitality.",2025-09-08 22:36:12,en,"Every member of the Marina Bay Sands team we encountered went above and beyond, turning what could have been just another hotel stay into an unforgettable experience filled with care, comfort, and heart.

A minor accident during our stay—when our daughter tripped over the carpet and had a nosebleed—was handled with exemplary care. The staff member from Express Service prioritized her safety and promptly coordinated housekeeping to assist us. The housekeeping lady who came to help was so humble and kind, even declining a tip for her hard work.

Special recognition also goes to Service Management Team, Ms. Ella Barrientos, who followed up with a compassionate call, offered a thoughtful gift to cheer up our daughter, and even took care of cleaning her top. The warmth and humanity she showed meant so much to us, and we would also like to thank the laundry team for their assistance in removing the blood stain so efficiently.

Our children’s first visit to Singapore has become a treasured memory thanks to the hotel’s exceptional hospitality."
9,椰‍子‍ ‍C‍o‍c‍o‍n‍u‍t,Sands Premier King,Stayed in June 2025,Booked for others,10.0,/10,Outstanding,"Posted June 30, 2025",Seamless check in and front desk staff is very friendly. Walking distance to Mall & MRT station. Location wise very centralised.,2025-09-08 22:36:13,en,Seamless check in and front desk staff is very friendly. Walking distance to Mall & MRT station. Location wise very centralised.
10,A‍n‍o‍n‍y‍m‍o‍u‍s‍ ‍U‍s‍e‍r,Sands Premier King Gardens By The Bay View,Stayed in May 2025,Family,9.0,/10,Great,"Posted May 27, 2025",good location and big shopping mall.  nice view and facilities. Will stay again for next trip to SG!,2025-09-08 22:36:13,en,good location and big shopping mall.  nice view and facilities. Will stay again for next trip to SG!
11,B‍o‍n‍a,Sands Premier King,Stayed in May 2025,Couple,10.0,/10,Outstanding,"Posted May 27, 2025",Very suitable for couples and families. Good service from staff and nice view from the room. Comfortable bed.,2025-09-08 22:36:19,en,Very suitable for couples and families. Good service from staff and nice view from the room. Comfortable bed.
12,V‍u‍n‍o‍d,Sands Premier King,Stayed in May 2025,Couple,10.0,/10,Outstanding,"Posted May 23, 2025","Had an amazing stay at Marina Bay Sands. The views from the infinity pool were unreal, and the room was super comfortable with everything I needed. Service was warm and professional throughout. Loved the food options and the vibe of the whole place, definitely one for the books. Would happily return.",2025-09-08 22:36:20,en,"Had an amazing stay at Marina Bay Sands. The views from the infinity pool were unreal, and the room was super comfortable with everything I needed. Service was warm and professional throughout. Loved the food options and the vibe of the whole place, definitely one for the books. Would happily return."
13,S‍a‍r‍i‍ ‍P‍a‍r‍k,Sands Family Suite,Stayed in April 2025,Family,9.5,/10,Amazing,"Posted April 26, 2025",I booked the family suite. They provided premium services. Could do early check in so didn't need to wait. They also prepared the backpack with lots of MBS souvenirs for my little ons,2025-09-08 22:36:20,en,I booked the family suite. They provided premium services. Could do early check in so didn't need to wait. They also prepared the backpack with lots of MBS souvenirs for my little ons
14,A‍g‍n‍e‍s‍l‍l‍c,Sands Premier Double Queen Gardens By The Bay View,Stayed in April 2025,Family,10.0,/10,Outstanding,"Posted June 10, 2025","Everything is good , except the queue to check in took very long . Waiting for the room also take some time.",2025-09-08 22:36:20,en,"Everything is good , except the queue to check in took very long . Waiting for the room also take some time."
15,G‍u‍e‍s‍t‍ ‍U‍s‍e‍r,Sands Premier Double Queen Gardens By The Bay View,Stayed in April 2025,Family,10.0,/10,Outstanding,"Posted April 22, 2025","Here's a polished English version of your hotel review:




**Excellent Hotel with Amazing Infinity Pool**  




We had a wonderful stay at this hotel! The infinity pool was absolutely fantastic, offering breathtaking views. Our children had a great time playing and swimming. The room was spacious and comfortable, making our stay even more enjoyable. Overall, it was an excellent experience, and we highly recommend this hotel to everyone!  
The staff were very friendly and helpful.
The location was perfect, with easy access to  
We would definitely stay here again!",2025-09-08 22:36:20,en,"Here's a polished English version of your hotel review:




**Excellent Hotel with Amazing Infinity Pool**  




We had a wonderful stay at this hotel! The infinity pool was absolutely fantastic, offering breathtaking views. Our children had a great time playing and swimming. The room was spacious and comfortable, making our stay even more enjoyable. Overall, it was an excellent experience, and we highly recommend this hotel to everyone!  
The staff were very friendly and helpful.
The location was perfect, with easy access to  
We would definitely stay here again!"
16,G‍u‍e‍s‍t‍ ‍U‍s‍e‍r,Sands Premier King City View,Stayed in April 2025,Family,10.0,/10,Outstanding,"Posted April 21, 2025","Very good experience, thanks to the front desk girl named Sandy. She was very gentle and helped us upgrade to a suite for free.",2025-09-08 22:36:21,en,"Very good experience, thanks to the front desk girl named Sandy. She was very gentle and helped us upgrade to a suite for free."
17,k‍r‍i‍s‍ ‍V‍e‍r‍a‍n‍o,Sands Premier King,Stayed in April 2025,Travelling with friends,10.0,/10,Outstanding,"Posted April 6, 2025","We had a truly wonderful stay at this hotel! From the moment we arrived, the staff made us feel so welcomed and cared for. The service was exceptional—friendly, accommodating, and always with a smile. The room was clean, comfortable, and had everything I needed for a relaxing stay. The ambiance of the hotel felt warm and inviting, making it feel like a home away from home. I’m very grateful for such a pleasant experience and would definitely recommend this hotel to anyone looking for a great place to stay. I’ll surely be back again!",2025-09-08 22:36:21,en,"We had a truly wonderful stay at this hotel! From the moment we arrived, the staff made us feel so welcomed and cared for. The service was exceptional—friendly, accommodating, and always with a smile. The room was clean, comfortable, and had everything I needed for a relaxing stay. The ambiance of the hotel felt warm and inviting, making it feel like a home away from home. I’m very grateful for such a pleasant experience and would definitely recommend this hotel to anyone looking for a great place to stay. I’ll surely be back again!"
18,s‍s‍d‍_‍r‍u,Sands Bay Suite King Gardens By The Bay View,Stayed in April 2025,Family,9.5,/10,Amazing,"Posted April 6, 2025","Excellent new renovations in the rooms, functional amenities at the highest level: furniture, design, layout, everything is meticulously thought out (sorry other hotels! but you all should stop by here to see for yourselves). The pool and dining are also top-notch. The only downside is the queues at breakfast, even in the executive club, and the staff there, that sometimes forget about you(( But overall, the service is excellent, and it starts literally from the moment you step off the plane. That’s why my rating is a solid 'excellent'.",2025-09-08 22:36:22,en,"Excellent new renovations in the rooms, functional amenities at the highest level: furniture, design, layout, everything is meticulously thought out (sorry other hotels! but you all should stop by here to see for yourselves). The pool and dining are also top-notch. The only downside is the queues at breakfast, even in the executive club, and the staff there, that sometimes forget about you(( But overall, the service is excellent, and it starts literally from the moment you step off the plane. That’s why my rating is a solid 'excellent'."
19,h‍z‍h‍a‍n‍g‍2‍6,Sands Premier King City View,Stayed in March 2025,Couple,10.0,/10,Outstanding,"Posted March 30, 2025","Excellent Trip at MBS Hotel, the scene is gorgeous and the swimming pool is beautiful and with good view of the CBD area.",2025-09-08 22:36:24,en,"Excellent Trip at MBS Hotel, the scene is gorgeous and the swimming pool is beautiful and with good view of the CBD area."
20,A‍n‍g‍e‍l‍ ‍K‍i,Sands Premier King,Stayed in April 2025,Family,10.0,/10,Outstanding,"Posted May 2, 2025","Very good service and great spot to stay.
They offer kids amenity and baby cot",2025-09-08 22:36:24,en,"Very good service and great spot to stay.
They offer kids amenity and baby cot"
21,H‍a‍n‍s‍p‍e‍t‍e‍r‍ ‍K‍e‍l‍l‍e‍r,Sands Premier King,Stayed in March 2025,Family,9.5,/10,Amazing,"Posted March 18, 2025","It's an expensive hotel, but I would recommend to spend at least 1 night there. You can do an early check-in, which allowed you to use the pool, fitness or observation deck already (it's a temporary card till you can check-in your room) . So you can enjoy some amenities there already. The room was huge and very clean. The shopping mall connected also has many brands names, and some restaurants. A good court is at the mall as well. A ****** is there as well. If you like ********.",2025-09-08 22:36:30,en,"It's an expensive hotel, but I would recommend to spend at least 1 night there. You can do an early check-in, which allowed you to use the pool, fitness or observation deck already (it's a temporary card till you can check-in your room) . So you can enjoy some amenities there already. The room was huge and very clean. The shopping mall connected also has many brands names, and some restaurants. A good court is at the mall as well. A ****** is there as well. If you like ********."
22,G‍u‍e‍s‍t‍ ‍U‍s‍e‍r,Sands Premier King,Stayed in April 2025,Couple,9.5,/10,Amazing,"Posted May 3, 2025","Very nice and comfortable, but got 4 th floor. The pool is excellent!",2025-09-08 22:36:31,en,"Very nice and comfortable, but got 4 th floor. The pool is excellent!"
23,S‍c‍o‍t‍t,Sands Premier King,Stayed in March 2025,Couple,10.0,/10,Outstanding,"Posted March 17, 2025","Amazing experience definitely worth it. The skypool was breathtaking, especially at night.",2025-09-08 22:36:31,en,"Amazing experience definitely worth it. The skypool was breathtaking, especially at night."
24,S‍i‍m‍o‍n‍ ‍N‍i‍c‍h‍o‍l‍a‍s,Sands Premier King City View,Stayed in August 2025,Couple,10.0,/10,Outstanding,"Posted August 20, 2025","MBS is simply awesome however, if you’re not-picking I would say the Libby area and entrance are very crowded, and check-in can be slow. 

The crowded aspect is because the hotel is part of a ****** and convention centre. The slow mosh check-in is because the hotel is so popular.

Apart from that, everything is really great - including the bed which was just the right amount of firmness for me.,",2025-09-08 22:36:31,en,"MBS is simply awesome however, if you’re not-picking I would say the Libby area and entrance are very crowded, and check-in can be slow. 

The crowded aspect is because the hotel is part of a ****** and convention centre. The slow mosh check-in is because the hotel is so popular.

Apart from that, everything is really great - including the bed which was just the right amount of firmness for me.,"
25,G‍u‍e‍s‍t‍ ‍U‍s‍e‍r,Sands Premier Double Queen,Stayed in July 2025,Business traveller,7.0,/10,,"Posted July 26, 2025",Nice view,2025-09-08 22:36:32,en,Nice view
26,P‍h‍y‍l‍l‍i‍s,Sands Bay Suite Double Queen Gardens By The Bay View,Stayed in August 2025,Family,10.0,/10,Outstanding,"Posted August 24, 2025","complex hotel with Casio,  shopping mall, and center of Sinapore , nice place but high expenses",2025-09-08 22:36:33,en,"complex hotel with Casio,  shopping mall, and center of Sinapore , nice place but high expenses"
27,T‍I‍N‍G‍X‍I‍A‍O,Sands Premier Double Queen,Stayed in February 2025,Family,10.0,/10,Outstanding,"Posted February 13, 2025","it's favoured to be arranged in a room with magnifique city view. super nice receptionist, merci!",2025-09-08 22:36:33,en,"it's favoured to be arranged in a room with magnifique city view. super nice receptionist, merci!"
28,M‍o‍m‍o‍J‍J,Sands Premier King City View,Stayed in May 2025,Couple,10.0,/10,Outstanding,"Posted May 12, 2025",Amazing view with luxury room service!,2025-09-08 22:36:33,en,Amazing view with luxury room service!
29,G‍u‍e‍s‍t‍ ‍U‍s‍e‍r,Sands Bay Suite King Gardens By The Bay View,Stayed in April 2025,Family,10.0,/10,Outstanding,"Posted May 4, 2025",Very Amazzzing hotel! High recommendation!,2025-09-08 22:36:33,en,Very Amazzzing hotel! High recommendation!
30,I‍v‍a‍n,Sands Premier Double Queen Gardens By The Bay View,Stayed in March 2025,Family,10.0,/10,Outstanding,"Posted March 27, 2025",Amazing! Service is great! Rooms were renovated recently.,2025-09-08 22:36:33,en,Amazing! Service is great! Rooms were renovated recently.
31,I‍n‍e‍z‍ ‍爹‍ ‍I‍s‍s‍e‍y,Sands Premier King,Stayed in July 2025,Family,10.0,/10,Outstanding,"Posted July 24, 2025",Very well maintain rooms & pool.. Love the access to so many restuarant options available within the hotel.,2025-09-08 22:36:39,en,Very well maintain rooms & pool.. Love the access to so many restuarant options available within the hotel.
32,A‍l‍e‍x‍ ‍K‍u‍r‍b‍a‍t,Sands Premier King Gardens By The Bay View,Stayed in March 2025,Couple,10.0,/10,Outstanding,"Posted March 25, 2025",Amazing luxurious stay. Would definitely come back again.,2025-09-08 22:36:39,en,Amazing luxurious stay. Would definitely come back again.
33,J‍Z‍1,Sands Bay Suite King Gardens By The Bay View,Stayed in July 2025,Business traveller,8.5,/10,Very Good,"Posted July 31, 2025","Very very overrated hotel, don't trust the Instagram hype.  The ceilings are very low for a hotel of this calibre so all the rooms felt small and claustrophobic.  Booked an 81sq meter suite and it felt tiny so I asked the front desk and they said the 81sq meters included the balcony and walls.  Who does that?  There were two TVs in the room and one of them wasn't functioning properly.  This is a $2000 SGD a night room mind you.  Room service was below average, really not 5 star standards.  Service overall was excellent however but that does not make up for the low ceilings and tiny rooms that they advertise as big.  Disappointing overall experience and would not stay here again in the future.",2025-09-08 22:36:39,en,"Very very overrated hotel, don't trust the Instagram hype.  The ceilings are very low for a hotel of this calibre so all the rooms felt small and claustrophobic.  Booked an 81sq meter suite and it felt tiny so I asked the front desk and they said the 81sq meters included the balcony and walls.  Who does that?  There were two TVs in the room and one of them wasn't functioning properly.  This is a $2000 SGD a night room mind you.  Room service was below average, really not 5 star standards.  Service overall was excellent however but that does not make up for the low ceilings and tiny rooms that they advertise as big.  Disappointing overall experience and would not stay here again in the future."
34,S,Sands Premier Double Queen Gardens By The Bay View,Stayed in July 2025,Family,10.0,/10,Outstanding,"Posted July 21, 2025","High quality, High kindness hospitality, High floor city view, High comfortablility and the High cost.",2025-09-08 22:36:40,en,"High quality, High kindness hospitality, High floor city view, High comfortablility and the High cost."
35,S‍t‍a‍c‍e‍y‍ ‍C‍h‍e‍n,Sands Premier Double Queen City View Room,Stayed in July 2025,Booked for others,10.0,/10,Outstanding,"Posted July 22, 2025",My friends very happy and enjoying staying at Marina Bay Hotel.Have fun and enjoy themselves 🙏💕😊🤝,2025-09-08 22:36:41,en,My friends very happy and enjoying staying at Marina Bay Hotel.Have fun and enjoy themselves 🙏💕😊🤝
36,S‍u‍r‍a‍-‍8‍ ‍m‍g‍l,Sands Premier King,Stayed in January 2025,Family,10.0,/10,Outstanding,"Posted January 4, 2025",Very nice very comfortable hotel ever. Our departure flight was in the night and staff says we can use pool after check out until go to airport. That was very nice 😊,2025-09-08 22:36:41,en,Very nice very comfortable hotel ever. Our departure flight was in the night and staff says we can use pool after check out until go to airport. That was very nice 😊
37,V‍l‍a‍d‍_‍Q‍i‍n‍g‍d‍a‍o‍_‍G‍o‍s‍l‍a‍r,Sands Family Suite,Stayed in December 2024,Family,10.0,/10,Outstanding,"Posted December 24, 2024",Excellent service for a great price!! I can only recommend VIP Privat if you want to enjoy the full service and comfort of this unique hotel! Thanks,2025-09-08 22:36:41,en,Excellent service for a great price!! I can only recommend VIP Privat if you want to enjoy the full service and comfort of this unique hotel! Thanks
38,G‍u‍e‍s‍t‍ ‍U‍s‍e‍r,Sands Premier Double Queen Gardens By The Bay View,Stayed in April 2025,Family,10.0,/10,Outstanding,"Posted April 24, 2025",Very very very nice,2025-09-08 22:36:41,en,Very very very nice
39,v‍b‍8,Sands Premier Double Queen City View Room,Stayed in May 2025,Family,10.0,/10,Outstanding,"Posted June 28, 2025",it was a very memorable stay for us. everything was perfect. hope can give more discounts next time,2025-09-08 22:36:41,en,it was a very memorable stay for us. everything was perfect. hope can give more discounts next time
40,M‍u‍h‍a‍m‍a‍d‍ ‍a‍r‍i‍f‍ ‍s‍a‍f‍w‍a‍n,Sands Premier King Gardens By The Bay View,Stayed in May 2025,Family,10.0,/10,Outstanding,"Posted May 11, 2025",Good 👍,2025-09-08 22:36:41,en,Good 👍
