serial_no,reviewer_name,room_type,period_of_stay,traveler_type,review_score_numerator,review_score_denominator,review_score_description,review_date,review_text,extraction_timestamp,review_detected_lang,review_translated
422,G‍u‍e‍s‍t‍ ‍U‍s‍e‍r,,Stayed in June 2024,Family,9.0,/10,Great,"Posted June 26, 2024","The infinity pool, the scenery is really great, a very good experience! Hope to experience it again next time! The service staff are professional and considerate. It’s a very good experience. I’ll come again if I have the chance😜👍👍✈️🏠",2025-09-08 22:44:06,en,"The infinity pool, the scenery is really great, a very good experience! Hope to experience it again next time! The service staff are professional and considerate. It’s a very good experience. I’ll come again if I have the chance😜👍👍✈️🏠"
423,G‍u‍e‍s‍t‍ ‍U‍s‍e‍r,Sands Premier King Gardens By The Bay View,Stayed in June 2025,Couple,10.0,/10,Outstanding,"Posted June 29, 2025",It was very luxurious and the best. It was great.,2025-09-08 22:44:07,en,It was very luxurious and the best. It was great.
424,G‍u‍e‍s‍t‍ ‍U‍s‍e‍r,,Stayed in June 2024,Couple,10.0,/10,Outstanding,"Posted June 25, 2024","My first trip to Singapore, MBS was a choice I have no regrets about.
The view of Gardens by the Bay from the room, the city view from the infinity pool, and the night view were all so happy and great.
The staff at the reception and the staff who carried my luggage were also kind, and I was able to see the mall and *** in detail.",2025-09-08 22:44:07,en,"My first trip to Singapore, MBS was a choice I have no regrets about.
The view of Gardens by the Bay from the room, the city view from the infinity pool, and the night view were all so happy and great.
The staff at the reception and the staff who carried my luggage were also kind, and I was able to see the mall and *** in detail."
425,n‍g‍a‍i,Sands Premier King City View,Stayed in December 2024,Couple,10.0,/10,Outstanding,"Posted December 21, 2024","An unforgettable accommodation experience. The staff is very nice and everyone serves you with a warm smile. When they heard that it was our wedding anniversary, they upgraded us to a super VIP suite for free. We almost cried out when we saw the room. The infinity pool is simply intoxicating, and the breakfast is very rich. If you are lucky, you can try your luck at ******. The shopping mall opposite has a wide variety of products. It is truly a world-class hotel. I will definitely stay here again next time.",2025-09-08 22:44:08,en,"An unforgettable accommodation experience. The staff is very nice and everyone serves you with a warm smile. When they heard that it was our wedding anniversary, they upgraded us to a super VIP suite for free. We almost cried out when we saw the room. The infinity pool is simply intoxicating, and the breakfast is very rich. If you are lucky, you can try your luck at ******. The shopping mall opposite has a wide variety of products. It is truly a world-class hotel. I will definitely stay here again next time."
426,G‍u‍e‍s‍t‍ ‍U‍s‍e‍r,Sands Premier Double Queen Gardens By The Bay View,Stayed in December 2024,Family,8.0,/10,Very Good,"Posted December 19, 2024","Overall, I was satisfied. However, there were some problems with the service. 
When I checked in, they said they would send me a text message when the room was ready, but the text message came too late. 
Even though I booked a package that included breakfast, breakfast was added when I checked out. When checking out, do not do automatic checkout, and check carefully.",2025-09-08 22:44:10,en,"Overall, I was satisfied. However, there were some problems with the service. 
When I checked in, they said they would send me a text message when the room was ready, but the text message came too late. 
Even though I booked a package that included breakfast, breakfast was added when I checked out. When checking out, do not do automatic checkout, and check carefully."
427,k‍E‍n‍1‍4‍1‍0,Sands Premier Double Queen,Stayed in December 2024,Other,10.0,/10,Outstanding,"Posted December 16, 2024","This was my fourth time using the hotel, and all the staff at the front desk, cloakroom, taxi stand, etc. were very polite and helpful! 

The price was a little high, but I felt the service was well worth it!",2025-09-08 22:44:11,en,"This was my fourth time using the hotel, and all the staff at the front desk, cloakroom, taxi stand, etc. were very polite and helpful! 

The price was a little high, but I felt the service was well worth it!"
428,f‍s‍s‍6‍1‍6,,Stayed in June 2024,Family,10.0,/10,Outstanding,"Posted August 22, 2024","Very nice hotel, breakfast is also delicious. The swimming pool upstairs is very easy to take pictures! Behind breakfast is the Strait of Malacca! I really came to the place in the textbook!",2025-09-08 22:44:12,en,"Very nice hotel, breakfast is also delicious. The swimming pool upstairs is very easy to take pictures! Behind breakfast is the Strait of Malacca! I really came to the place in the textbook!"
429,B‍e‍n‍g‍d‍a‍d‍i‍x‍i‍n‍g‍x‍i‍n‍g,,Stayed in June 2024,Couple,8.7,/10,Very Good,"Posted June 21, 2024","First of all, I was a bit picky. I booked Tower 3. The tower was under renovation and it was very noisy during the day. Then I waited for almost an hour to check in at 3 o'clock. I didn't get the room card until almost 4 o'clock. The swimming pool I went to after 10 o'clock in the evening was very crowded, but The location is really good",2025-09-08 22:44:13,en,"First of all, I was a bit picky. I booked Tower 3. The tower was under renovation and it was very noisy during the day. Then I waited for almost an hour to check in at 3 o'clock. I didn't get the room card until almost 4 o'clock. The swimming pool I went to after 10 o'clock in the evening was very crowded, but The location is really good"
430,G‍u‍e‍s‍t‍ ‍U‍s‍e‍r,Sands Premier Double Queen Gardens By The Bay View,Stayed in April 2025,Couple,10.0,/10,Outstanding,"Posted April 29, 2025",An exceptional and unforgettable stay. I'd go back anytime!,2025-09-08 22:44:14,en,An exceptional and unforgettable stay. I'd go back anytime!
431,A‍n‍o‍n‍y‍m‍o‍u‍s‍ ‍U‍s‍e‍r,Sands Premier King Gardens By The Bay View,Stayed in June 2024,Business traveller,10.0,/10,Outstanding,"Posted June 17, 2024","It was my first time to Singapore. The front desk service was attentive and warm when I checked in. Mr. Leon was very considerate and upgraded me to a sea view suite for free. The scenery, facilities and comfort were unmatched! The service in all restaurants, swimming pools and other aspects of the hotel was very professional, warm and made me feel at home. This hotel is indeed the best in Singapore.",2025-09-08 22:44:21,en,"It was my first time to Singapore. The front desk service was attentive and warm when I checked in. Mr. Leon was very considerate and upgraded me to a sea view suite for free. The scenery, facilities and comfort were unmatched! The service in all restaurants, swimming pools and other aspects of the hotel was very professional, warm and made me feel at home. This hotel is indeed the best in Singapore."
432,A‍n‍o‍n‍y‍m‍o‍u‍s‍ ‍U‍s‍e‍r,,Stayed in September 2024,Couple,10.0,/10,Outstanding,"Posted October 24, 2024",Excellent comfortable pleasant hotel,2025-09-08 22:44:22,en,Excellent comfortable pleasant hotel
433,G‍u‍e‍s‍t‍ ‍U‍s‍e‍r,,Stayed in June 2024,Family,10.0,/10,Outstanding,"Posted June 27, 2024","The room is quite satisfactory. The most important thing about staying at the Sands is Singapore's national landmark building, with unobstructed views, the Strait of Malacca, and the infinity pool. The service attitude is still very good, with a Chinese reception 💁♀️! Worth a stay",2025-09-08 22:44:22,en,"The room is quite satisfactory. The most important thing about staying at the Sands is Singapore's national landmark building, with unobstructed views, the Strait of Malacca, and the infinity pool. The service attitude is still very good, with a Chinese reception 💁♀️! Worth a stay"
434,M‍e‍i‍m‍e‍i‍m‍e‍i‍n‍i‍u,,Stayed in June 2024,Booked for others,10.0,/10,Outstanding,"Posted June 7, 2024",I made a reservation for my child. I saw the night view photos sent by my child of the infinity pool at night. The entire Singapore is very beautiful!,2025-09-08 22:44:23,en,I made a reservation for my child. I saw the night view photos sent by my child of the infinity pool at night. The entire Singapore is very beautiful!
435,G‍u‍x‍i‍a‍n‍g‍f‍e‍n‍g‍y‍u‍e‍y‍o‍u‍s‍h‍u‍i‍z‍h‍e‍n‍g,,Stayed in May 2024,Couple,10.0,/10,Outstanding,"Posted May 19, 2024","This is my second time staying at this top luxury hotel with an invincible rooftop swimming pool! It feels more comfortable than the last time! From service to facilities to catering, the overall is good! I hope it will continue to be maintained and updated! I will come again if I have the chance in the future!",2025-09-08 22:44:24,en,"This is my second time staying at this top luxury hotel with an invincible rooftop swimming pool! It feels more comfortable than the last time! From service to facilities to catering, the overall is good! I hope it will continue to be maintained and updated! I will come again if I have the chance in the future!"
436,Z‍h‍e‍n‍g‍b‍e‍i‍s‍h‍i,,Stayed in June 2024,Couple,10.0,/10,Outstanding,"Posted June 5, 2024","The hygiene was impeccable, the room was very clean and tidy, and there were no hygienic blind spots. As a germaphobe, I didn't even use the sheets I brought with me. I also prepared two pairs of good quality disposable slippers, although I didn't use them. The bathroom supplies are also one of the most abundant I have ever seen in a hotel.

The environment is also perfect, with the bay cityscape on one side and the bay garden landscape on the other. The difference is not big, both are beautiful. The underground level is directly connected to the subway station, and there is also a luxury shopping mall that is the same size as the first floor of the hotel. Of course, the most worthwhile thing to visit is the sky garden and infinity swimming pool on the roof, which can account for at least 1/3 of the house price😂

The service is first-class. I stayed for one night and received a bunch of bottled water and snacks. But please note that some snacks and drinks require payment, and there is no clearly visible price list for you to see. This is probably because Paying guests won't care. There will be a queue for breakfast after 9 a.m., so be careful.

The facilities are complete, but the only drawback is that there is no resting place in the lobby. There is only a circle of marble floor for temporary resting, and there is no backrest. It is much worse than the humanized lobby of Shangri-La. It may be because it will be overcrowded.
Finally, let me talk about a fly in the ointment, that is, the hotel price is a bit high hahahaha, but there are still many people because it is very popular😃",2025-09-08 22:44:26,en,"The hygiene was impeccable, the room was very clean and tidy, and there were no hygienic blind spots. As a germaphobe, I didn't even use the sheets I brought with me. I also prepared two pairs of good quality disposable slippers, although I didn't use them. The bathroom supplies are also one of the most abundant I have ever seen in a hotel.

The environment is also perfect, with the bay cityscape on one side and the bay garden landscape on the other. The difference is not big, both are beautiful. The underground level is directly connected to the subway station, and there is also a luxury shopping mall that is the same size as the first floor of the hotel. Of course, the most worthwhile thing to visit is the sky garden and infinity swimming pool on the roof, which can account for at least 1/3 of the house price😂

The service is first-class. I stayed for one night and received a bunch of bottled water and snacks. But please note that some snacks and drinks require payment, and there is no clearly visible price list for you to see. This is probably because Paying guests won't care. There will be a queue for breakfast after 9 a.m., so be careful.

The facilities are complete, but the only drawback is that there is no resting place in the lobby. There is only a circle of marble floor for temporary resting, and there is no backrest. It is much worse than the humanized lobby of Shangri-La. It may be because it will be overcrowded.
Finally, let me talk about a fly in the ointment, that is, the hotel price is a bit high hahahaha, but there are still many people because it is very popular😃"
437,M‍I‍K‍I‍Y‍A,Sands Premier Double Queen,Stayed in December 2024,Couple,10.0,/10,Outstanding,"Posted December 6, 2024","Everything was great. I think the price was reasonable.
The breakfast was also excellent and I thought this was a hotel that people of all ages could enjoy. I'd like to stay here again.",2025-09-08 22:44:27,en,"Everything was great. I think the price was reasonable.
The breakfast was also excellent and I thought this was a hotel that people of all ages could enjoy. I'd like to stay here again."
438,G‍u‍e‍s‍t‍ ‍U‍s‍e‍r,Sands Premier King,Stayed in June 2024,Solo traveller,10.0,/10,Outstanding,"Posted June 6, 2024","Third visit. Every time I come, the staff is always friendly. Room condition is good.
What's disappointing is that the pool water is a little dirty. Because there are so many users...
If you go to the swimming pool in the middle of the day and the sun is shining, it gets very hot and burns quickly. Recommended to use at night.
Recommend creating a reward card. Discounts available when using the spa.",2025-09-08 22:44:27,en,"Third visit. Every time I come, the staff is always friendly. Room condition is good.
What's disappointing is that the pool water is a little dirty. Because there are so many users...
If you go to the swimming pool in the middle of the day and the sun is shining, it gets very hot and burns quickly. Recommended to use at night.
Recommend creating a reward card. Discounts available when using the spa."
439,M‍o‍s‍h‍a‍n‍g‍h‍u‍a‍k‍a‍i‍L‍a‍x‍i‍a‍o‍r‍r‍y,Sands Premier Double Queen City View Room,Stayed in May 2024,Family,10.0,/10,Outstanding,"Posted May 21, 2024","Stayed twice, in a king-size room and a twin-bed room, but booked the latest renovated city view room, from which you can see the central business district, the bay, and the Merlion Park. The night view is also beautiful, and there are fountain shows. The newly renovated upgraded square room is large, and comes with chocolates and small candies, which are delicious. The service is particularly enthusiastic, and you can refill water at any time. Ask for a few more delicious chocolates. You must check in at the rooftop infinity pool, which is beautiful. The toiletries are from Jo Malone, and the razor is an antique design with a wooden handle, which is very special. Except that it is a bit expensive, there is basically nothing wrong with it. There are many set meals downstairs, which is extremely convenient and interesting to take parents and son out for a trip. It is very pleasant to lie on the bed and watch the scenery outside the window in the morning. Although it is a little expensive, I think I will come again next time",2025-09-08 22:44:28,en,"Stayed twice, in a king-size room and a twin-bed room, but booked the latest renovated city view room, from which you can see the central business district, the bay, and the Merlion Park. The night view is also beautiful, and there are fountain shows. The newly renovated upgraded square room is large, and comes with chocolates and small candies, which are delicious. The service is particularly enthusiastic, and you can refill water at any time. Ask for a few more delicious chocolates. You must check in at the rooftop infinity pool, which is beautiful. The toiletries are from Jo Malone, and the razor is an antique design with a wooden handle, which is very special. Except that it is a bit expensive, there is basically nothing wrong with it. There are many set meals downstairs, which is extremely convenient and interesting to take parents and son out for a trip. It is very pleasant to lie on the bed and watch the scenery outside the window in the morning. Although it is a little expensive, I think I will come again next time"
440,G‍u‍e‍s‍t‍ ‍U‍s‍e‍r,,Stayed in June 2024,Solo traveller,10.0,/10,Outstanding,"Posted June 8, 2024",I really enjoyed the friendly greetings from the staff and especially meeting Kelly at check-in.,2025-09-08 22:44:29,en,I really enjoyed the friendly greetings from the staff and especially meeting Kelly at check-in.
441,A‍n‍o‍n‍y‍m‍o‍u‍s‍ ‍U‍s‍e‍r,,Stayed in June 2024,Solo traveller,10.0,/10,Outstanding,"Posted June 9, 2024","Next to the shopping mall, it is very convenient to go to various landmarks and attractions👍",2025-09-08 22:44:36,en,"Next to the shopping mall, it is very convenient to go to various landmarks and attractions👍"
442,A‍n‍o‍n‍y‍m‍o‍u‍s‍ ‍U‍s‍e‍r,Sands Bay Suite Double Queen Gardens By The Bay View,Stayed in August 2025,Travelling with friends,10.0,/10,Outstanding,"Posted August 15, 2025","The room is very good, very satisfied",2025-09-08 22:44:37,en,"The room is very good, very satisfied"
443,G‍u‍e‍s‍t‍ ‍U‍s‍e‍r,,Stayed in November 2024,Travelling with friends,10.0,/10,Outstanding,"Posted December 21, 2024","The hotel is an icon of Singapore, if possible, you should visit. We took the cheapest room, located on the lower floors. We were on the third floor, otherwise the room is ordinary. Good beds, the room had a free minibar, coffee machine. The robes are very small. The pool is beautiful, gorgeous views, open from early morning until late, unlimited towels, water, they carry guava juice. You can have a snack for reasonable money for Singapore. It's bad that there are no umbrellas from the sun. At the reception they met us halfway and did not take a deposit, because the card did not work. They also extended the room for 2 hours for free.",2025-09-08 22:44:37,en,"The hotel is an icon of Singapore, if possible, you should visit. We took the cheapest room, located on the lower floors. We were on the third floor, otherwise the room is ordinary. Good beds, the room had a free minibar, coffee machine. The robes are very small. The pool is beautiful, gorgeous views, open from early morning until late, unlimited towels, water, they carry guava juice. You can have a snack for reasonable money for Singapore. It's bad that there are no umbrellas from the sun. At the reception they met us halfway and did not take a deposit, because the card did not work. They also extended the room for 2 hours for free."
444,G‍u‍e‍s‍t‍ ‍U‍s‍e‍r,,Stayed in May 2024,Travelling with friends,10.0,/10,Outstanding,"Posted May 23, 2024","This is my first trip with friends since the COVID-19 pandemic. I was very satisfied with everything from the pool to the rooms, hospitality, and food. This is a hotel I would definitely like to stay at if I come to Singapore.",2025-09-08 22:44:38,en,"This is my first trip with friends since the COVID-19 pandemic. I was very satisfied with everything from the pool to the rooms, hospitality, and food. This is a hotel I would definitely like to stay at if I come to Singapore."
445,G‍u‍e‍s‍t‍ ‍U‍s‍e‍r,,Stayed in May 2024,Travelling with friends,10.0,/10,Outstanding,"Posted June 3, 2024","The view was really nice, the room was really clean, and the staff were all friendly. The infinity pool was really nice. I would definitely go here for one night when I go to Singapore.",2025-09-08 22:44:38,en,"The view was really nice, the room was really clean, and the staff were all friendly. The infinity pool was really nice. I would definitely go here for one night when I go to Singapore."
446,V‍e‍y‍u‍n‍g,,Stayed in May 2024,Couple,7.5,/10,,"Posted May 25, 2024","Singapore's landmark hotel, you can enjoy VIP treatment after staying in, and you can go to the rooftop sky garden for free. The rooftop swimming pool is also free, and it is a must-visit place.
However, the room is close to the elevator, the elevator is noisy, and there is construction drilling upstairs, which is annoying.",2025-09-08 22:44:38,en,"Singapore's landmark hotel, you can enjoy VIP treatment after staying in, and you can go to the rooftop sky garden for free. The rooftop swimming pool is also free, and it is a must-visit place.
However, the room is close to the elevator, the elevator is noisy, and there is construction drilling upstairs, which is annoying."
447,H‍a‍r‍r‍y,,Stayed in April 2024,Family,10.0,/10,Outstanding,"Posted April 12, 2024","Check in at Marina Bay Sands Resort, Singapore
This should be one of the best hotels in Singapore. Tourists who come here to stay come from all over the world, and the entire lobby is full of tourists waiting to check in.
The hotel front desk is very good, and upgraded me to a sea view room for free, and gave me a birthday cake for free🎂The sea view room is really beautiful, the scenery is great, the room is large, all the free utensils are very high-end, the chocolate cake is great, and the taste is very good.
In general, this is the most expensive and high-end hotel I have ever stayed in. The scenery, service and facilities are worthy of its price. You must stay at Marina Bay Sands Hotel once when you come to Singapore.",2025-09-08 22:44:39,en,"Check in at Marina Bay Sands Resort, Singapore
This should be one of the best hotels in Singapore. Tourists who come here to stay come from all over the world, and the entire lobby is full of tourists waiting to check in.
The hotel front desk is very good, and upgraded me to a sea view room for free, and gave me a birthday cake for free🎂The sea view room is really beautiful, the scenery is great, the room is large, all the free utensils are very high-end, the chocolate cake is great, and the taste is very good.
In general, this is the most expensive and high-end hotel I have ever stayed in. The scenery, service and facilities are worthy of its price. You must stay at Marina Bay Sands Hotel once when you come to Singapore."
448,D‍a‍d‍a‍f‍u‍z‍i,Sands Premier King,Stayed in May 2024,Couple,7.0,/10,,"Posted May 15, 2024","I waited for 2 hours to do a business but nothing was done. They said I could get a room upgrade, but it wasn't. I couldn't delay check-out. Such an expensive hotel doesn't answer anything I asked. The business skills are also poor. The service is really bad. Try not to stay there. It's not worth getting angry. Everything except the water costs money. The experience is not good at all",2025-09-08 22:44:41,en,"I waited for 2 hours to do a business but nothing was done. They said I could get a room upgrade, but it wasn't. I couldn't delay check-out. Such an expensive hotel doesn't answer anything I asked. The business skills are also poor. The service is really bad. Try not to stay there. It's not worth getting angry. Everything except the water costs money. The experience is not good at all"
449,G‍u‍e‍s‍t‍ ‍U‍s‍e‍r,,Stayed in June 2024,Travelling with friends,10.0,/10,Outstanding,"Posted July 13, 2024",The pool view car is really nice. The room is spacious and I want to go again.,2025-09-08 22:44:42,en,The pool view car is really nice. The room is spacious and I want to go again.
450,A‍n‍o‍n‍y‍m‍o‍u‍s‍ ‍U‍s‍e‍r,Sands Family Suite,Stayed in February 2025,Family,10.0,/10,Outstanding,"Posted February 25, 2025","It is simply a top hotel, an experience you won't forget so quickly",2025-09-08 22:44:42,en,"It is simply a top hotel, an experience you won't forget so quickly"
